Sneaker,Relevant Sale Event,Tentative Dates,Expected Extra Discount,Wait or Buy Now?,Reasoning
Adidas Campus 00s,Adidas End of Season Sale (already live),Ongoing now (Jul 2026),"30% off + extra 15% on orders >= Rs.4,999 (adidas.co.in)",BUY NOW,"This is already close to the best markdown adidas.co.in offers; Ajio Luxe price (Rs.6,489) is already lower than most upcoming sale estimates would beat by much."
Adidas Campus 00s,Myntra Right to Fashion Sale,~31 Jul - 18 Aug 2026 (dates vary by source),40-75% off footwear (site-wide category range),COULD WAIT,"If not urgent, this Myntra sale in the next 2-4 weeks could beat the current Myntra price; Ajio price is already competitive though."
Nike Air Max Solo,Myntra Right to Fashion Sale,~31 Jul - 18 Aug 2026,Up to 50-75% off footwear,COULD WAIT (marginal),"Already at 50% off in-app; further drop possible but marginal - current Rs.4,348 is already a strong price."
Nike Air Max Solo,Myntra Big Fashion Festival (BFF),~22 Sep 2026 (biggest Myntra sale of the year),"50-90% off, Nike included per past events",WAIT IF NOT URGENT,"Historically Myntra's biggest sale of the year with Nike specifically called out; if you can wait ~2 months, this is likely to beat all current prices."
Nike Dunk Low SE Monsoon Blue,Culture Circle / resale platforms,No fixed 'sale season' - resale pricing is dynamic,Varies by seller/demand,BUY WHEN READY,"Resale marketplace pricing (Culture Circle, Mainstreet, Superkicks) fluctuates with demand/stock rather than calendar sales; waiting doesn't reliably guarantee a lower price, and Xpress Ship stock (like the DSWT listing) can sell out."
All 3,Ajio All Stars Sale,~13-20 Sep 2026,"50-90% off, footwear specifically called out",WAIT IF FLEXIBLE ON ADIDAS/NIKE RETAIL LISTINGS,"Large festive sale historically covering Adidas, Nike, Puma at 50-70% off - relevant for the retail (non-resale) sneakers."
Note:,"Sale dates above are third-party estimates (aggregator sites), not official brand/platform announcements, and can shift. adidas.co.in's End of Season Sale is confirmed live as of this research (19 Jul 2026). I'll keep checking prices as you share new screenshots and update this sheet with more current sale info.",,,,
